{
  "agent": "vcs-agent",
  "runId": "pr-18-a958beb-20261006",
  "taskId": "user-request-stage-commit-pr-18",
  "timestamp": "2026-10-06T18:56:07.7826363+03:00",
  "status": "completed",
  "summary": "Committed the Android release-signing changes as a958beb on fix/android-release-signing, pushed the branch, and opened PR #18 against main. git diff --cached --check passed before commit; Flutter/Gradle tests and release build were not run. Line-ending-only generated desktop registrant changes were left unstaged.",
  "confidence": 1.0,
  "artifacts": [
    {
      "kind": "branch",
      "ref": "fix/android-release-signing"
    },
    {
      "kind": "pull_request",
      "ref": "https://github.com/i-gun/ai.Electricity/pull/18"
    },
    {
      "kind": "log",
      "ref": "logs/vcs-agent/pr-18-a958beb-20261006.json"
    }
  ]
}